{
  "apiVersion": "agentic-sdlc-kit/v1",
  "provider": "codex",
  "version": "0.1.0",
  "canonicalSkills": [
    {
      "id": "bounded-implementation",
      "version": "0.1.0",
      "digest": "bb9cf5cb608ae0e060abc80312e02049cfef3938bc42126bba14c0f538f1f6c8",
      "actionBand": "workspace",
      "controlPoints": {
        "enter": [
          "implementation-chart-approved"
        ],
        "exit": []
      },
      "requires": {
        "artifacts": [
          "ground-packet",
          "change-chart"
        ],
        "states": [
          "planned",
          "changes_required"
        ]
      },
      "produces": {
        "artifacts": [
          "claim-record",
          "handoff-bundle"
        ],
        "states": [
          "implementing"
        ]
      },
      "freshness": {
        "bindToRevision": true
      },
      "permissions": {
        "filesystem": "write",
        "shell": "allowlisted",
        "network": "deny",
        "secrets": "deny",
        "externalMutation": "deny"
      },
      "reductions": []
    },
    {
      "id": "change-assessment",
      "version": "0.1.0",
      "digest": "9bb6d98206c5f43f267700c73a9d632784cace8c761a880a6d594a2a1ea46f10",
      "actionBand": "recommend",
      "controlPoints": {
        "enter": [
          "verification-sources-current"
        ],
        "exit": [
          "assessment-complete"
        ]
      },
      "requires": {
        "artifacts": [
          "ground-packet",
          "change-chart",
          "verification-matrix",
          "claim-record",
          "security-findings",
          "required-source-list"
        ],
        "states": [
          "verifying"
        ]
      },
      "produces": {
        "artifacts": [
          "claim-record",
          "trail-record"
        ],
        "states": [
          "assessing"
        ]
      },
      "freshness": {
        "bindToRevision": true
      },
      "permissions": {
        "filesystem": "read",
        "shell": "deny",
        "network": "deny",
        "secrets": "deny",
        "externalMutation": "deny"
      },
      "reductions": []
    },
    {
      "id": "change-charting",
      "version": "0.1.0",
      "digest": "7c6453e8696e90fd3ff5e8906ffb59a80f8b9ed8a039ab2e95c46cb40a4cbb3a",
      "actionBand": "recommend",
      "controlPoints": {
        "enter": [
          "context-bounded"
        ],
        "exit": [
          "implementation-chart-approved"
        ]
      },
      "requires": {
        "artifacts": [
          "ground-packet",
          "repository-map",
          "requirement-map"
        ],
        "states": [
          "framed"
        ]
      },
      "produces": {
        "artifacts": [
          "change-chart",
          "reach-map",
          "trail-record"
        ],
        "states": [
          "planned"
        ]
      },
      "freshness": {
        "bindToRevision": true
      },
      "permissions": {
        "filesystem": "read",
        "shell": "deny",
        "network": "deny",
        "secrets": "deny",
        "externalMutation": "deny"
      },
      "reductions": []
    },
    {
      "id": "evidence-handoff",
      "version": "0.1.0",
      "digest": "e8a01a43089d4e286b95a4b55668f33199059b14e9eacff887bdf9b0e402f865",
      "actionBand": "recommend",
      "controlPoints": {
        "enter": [],
        "exit": []
      },
      "requires": {
        "artifacts": [
          "ground-packet"
        ],
        "states": [
          "unframed",
          "framed",
          "planned",
          "implementing",
          "verifying",
          "assessing",
          "release_ready",
          "releasing",
          "observing",
          "needs_input",
          "blocked",
          "changes_required",
          "release_failed",
          "regressed",
          "rolled_back",
          "completed"
        ]
      },
      "produces": {
        "artifacts": [
          "handoff-bundle",
          "trail-record"
        ],
        "states": [
          "unframed",
          "framed",
          "planned",
          "implementing",
          "verifying",
          "assessing",
          "release_ready",
          "releasing",
          "observing",
          "needs_input",
          "blocked",
          "changes_required",
          "release_failed",
          "regressed",
          "rolled_back",
          "completed"
        ]
      },
      "freshness": {
        "bindToRevision": true
      },
      "permissions": {
        "filesystem": "read",
        "shell": "deny",
        "network": "deny",
        "secrets": "deny",
        "externalMutation": "deny"
      },
      "reductions": []
    },
    {
      "id": "incident-learning",
      "version": "0.1.0",
      "digest": "cfa063508631a37d0a06438ce60e4fa492da4f1aea68cb14ab100a84f2ec3de6",
      "actionBand": "recommend",
      "controlPoints": {
        "enter": [],
        "exit": []
      },
      "requires": {
        "artifacts": [
          "ground-packet",
          "source-record-reference",
          "trail-record",
          "observation-record"
        ],
        "states": [
          "observing",
          "regressed",
          "rolled_back",
          "completed"
        ]
      },
      "produces": {
        "artifacts": [
          "trail-record",
          "ground-packet"
        ],
        "states": [
          "observing",
          "regressed",
          "rolled_back",
          "completed"
        ]
      },
      "freshness": {
        "bindToRevision": true
      },
      "permissions": {
        "filesystem": "read",
        "shell": "deny",
        "network": "deny",
        "secrets": "deny",
        "externalMutation": "deny"
      },
      "reductions": []
    },
    {
      "id": "intent-framing",
      "version": "0.1.0",
      "digest": "60847ff06158806ed83c91eaa3ea6b93d0950bc1ab389aaed82ccd55356adcfd",
      "actionBand": "recommend",
      "controlPoints": {
        "enter": [
          "context-bounded"
        ],
        "exit": []
      },
      "requires": {
        "artifacts": [
          "ground-packet",
          "repository-map"
        ],
        "states": [
          "framed"
        ]
      },
      "produces": {
        "artifacts": [
          "ground-packet",
          "requirement-map"
        ],
        "states": [
          "framed"
        ]
      },
      "freshness": {
        "bindToRevision": true
      },
      "permissions": {
        "filesystem": "read",
        "shell": "deny",
        "network": "deny",
        "secrets": "deny",
        "externalMutation": "deny"
      },
      "reductions": []
    },
    {
      "id": "production-observation",
      "version": "0.1.0",
      "digest": "485169c591d699f7b3d210948e34a5b9a0bfac3ad182d914f9b4999350088421",
      "actionBand": "observe",
      "controlPoints": {
        "enter": [
          "release-authorized"
        ],
        "exit": [
          "observation-complete"
        ]
      },
      "requires": {
        "artifacts": [
          "ground-packet",
          "release-packet",
          "source-record-reference"
        ],
        "states": [
          "releasing"
        ]
      },
      "produces": {
        "artifacts": [
          "trail-record",
          "observation-record",
          "source-record-reference"
        ],
        "states": [
          "observing"
        ]
      },
      "freshness": {
        "bindToRevision": true
      },
      "permissions": {
        "filesystem": "read",
        "shell": "deny",
        "network": "deny",
        "secrets": "deny",
        "externalMutation": "deny"
      },
      "reductions": []
    },
    {
      "id": "release-readiness",
      "version": "0.1.0",
      "digest": "55b785b8bd8730bb561c1e4b64234ae4efc1d85ad98de87034a53c66e3c38fd9",
      "actionBand": "gated",
      "controlPoints": {
        "enter": [
          "assessment-complete"
        ],
        "exit": [
          "release-authorized"
        ]
      },
      "requires": {
        "artifacts": [
          "ground-packet",
          "verification-matrix",
          "claim-record",
          "source-record-reference",
          "security-findings",
          "required-source-list"
        ],
        "states": [
          "assessing"
        ]
      },
      "produces": {
        "artifacts": [
          "release-packet"
        ],
        "states": [
          "release_ready"
        ]
      },
      "freshness": {
        "bindToRevision": true
      },
      "permissions": {
        "filesystem": "write",
        "shell": "deny",
        "network": "deny",
        "secrets": "deny",
        "externalMutation": "gated"
      },
      "reductions": []
    },
    {
      "id": "repository-discovery",
      "version": "0.1.0",
      "digest": "293705e2f39e623e1d6f1282d30eeb7c4c86d7165bc1aceef8b204c861e4c723",
      "actionBand": "observe",
      "controlPoints": {
        "enter": [],
        "exit": [
          "context-bounded"
        ]
      },
      "requires": {
        "artifacts": [
          "ground-packet"
        ],
        "states": [
          "unframed"
        ]
      },
      "produces": {
        "artifacts": [
          "repository-map",
          "trail-record"
        ],
        "states": [
          "framed"
        ]
      },
      "freshness": {
        "bindToRevision": true
      },
      "permissions": {
        "filesystem": "read",
        "shell": "deny",
        "network": "deny",
        "secrets": "deny",
        "externalMutation": "deny"
      },
      "reductions": []
    },
    {
      "id": "security-assessment",
      "version": "0.1.0",
      "digest": "951a0c5af4ae535ed2316c385e309d9221bd9c49be699f34b92639a376494253",
      "actionBand": "workspace",
      "controlPoints": {
        "enter": [],
        "exit": []
      },
      "requires": {
        "artifacts": [
          "ground-packet",
          "change-chart",
          "verification-matrix",
          "source-record-reference"